{
  "schema_version": "1.0.0",
  "scene_id": "COM-03J",
  "lifecycle": "CANONICAL",
  "source_scene": "docs/narrative/scenes/vertical-slice/COM-03J.md",
  "entry_state": {
    "relationships": [
      {
        "subject": "jiang_yucheng",
        "toward": "protagonist",
        "label": "acquaintances_with_specific_shared_context",
        "constraints": [
          "僅實際 COM-02J cafe 相遇後成立：週末書店 go 在後續平日 cafe 重逢，週末留家+cafe go 是第一次見面；當場才互知姓名、討論具體作品／畫圖內容。聯絡可能已經雙方同意交換，也可能正常未交換。"
        ]
      },
      {
        "subject": "protagonist",
        "toward": "jiang_yucheng",
        "label": "acquaintances_with_specific_shared_context",
        "constraints": [
          "只記得實際 COM-01J／COM-02J 當次演出的話題、可見畫圖和姓名；首次 cafe 相遇沒有書架共同回憶。平日街頭獨走時仍是互不相識的 strangers，直接 bypass Jiang 本幕。"
        ]
      }
    ],
    "knowledge": [
      {
        "holder": "jiang_yucheng",
        "knows": [
          "若確實 cafe 相遇，知道男主姓名和當場實際談的具體內容；科技工作／可攜工作僅在 COM-02J 真正說出後成立。",
          "只有實際互相同意且交換時才知道可用的聯絡管道。"
        ],
        "does_not_know": [
          "男主精確職稱、住處、未披露私人關係及許棠相關資訊。"
        ]
      },
      {
        "holder": "protagonist",
        "knows": [
          "若確實 cafe 相遇，知道江雨澄姓名、當場可見的畫圖及實際談到的作品細節；COM-01J 話題僅在書店 go 的可信 local history 成立。",
          "只有實際互相同意且交換時才知道可用的聯絡管道。"
        ],
        "does_not_know": [
          "她的匿名創作帳號、商業委託、完整繪師身份與住處。"
        ]
      }
    ],
    "constraints": [
      "COM-02J 是週末之後的平日下午 cafe reunion 或 first-meet；COM-03X 的平日晚間包裹完成後才開始同晚訊息。本幕沒有新的線下相遇。",
      "contact_jyc 只能承接本次 cafe 互相同意的實際 Discord 交換；未交換者 bypass 私訊，街頭當次無聯絡者 bypass 本幕全部 Jiang 內容。實際取得的累積初遇 eligibility（書店或 cafe 首遇）不代替 contact；未取得任何初遇時街頭排除仍有效。",
      "所有 callback 必須與實際 cafe dialogue 相符：書店重逢由書話題，不得默認談過她的角色動作／關圖層。若無某具體承接證據，選既有 neutral 首訊，不自行補前事。",
      "cafe 入口共用 GAME decision tree：僅初次遊玩或 replay 曾真正完成 COM-01J 書店初遇才用 reunion；單獨 cafe 首遇、cafe 首遇 replay、選 bookstore go 但尚未初遇、一般 met/contact 與 jycEverUnlocked 均不足。累積 eligibility 只解鎖可玩內容，不把另一段遊玩的購書、姓名、topic、contact、consent 或承諾併入當次事實。"
    ]
  },
  "scene_function": [
    "承接 COM-02J 同次 cafe 相遇的真實共同話題及其同意／未同意聯絡結果；不以第三次碰面建立 contact。",
    "已交換管道時，以有當地因果的公開作品推薦及當晚文字交流呈現雨澄在線下與熟悉題目的訊息節奏；未交換時僅普通結束，不產生私訊。",
    "讓男主對實際收到的圖像有具體回應；三種訊息收束風格只調整本次節奏及下次主動餘裕，不作聯絡資格或戀愛考試。"
  ],
  "character_intent": [
    {
      "character_id": "jiang_yucheng",
      "intent": "在 cafe 繼續自己當場有興趣的內容；若已同意交換，分享與當地話題相關的公開推薦，晚間可分析、補充、更正並確認對方是否有空。未交換時接受普通告別，不為交換而另造碰面。"
    },
    {
      "character_id": "protagonist",
      "intent": "按實際討論與已交換的管道接住可見推薦，表達真實觀察及今晚的回覆節奏；未交換時尊重 cafe 的結束，不追索帳號或把拒絕讀成戀愛結論。"
    }
  ],
  "player_information_gain": [
    "同一個人線下可短答，文字談熟悉內容時可更快、更長，也能用截圖、meme、自我更正說清楚；此差異只在實際已聯絡並收到內容的路徑可見。",
    "聯絡是 COM-02J 當場共同興趣及雙方同意的結果；未交換、未見面者都沒有雨澄私訊。",
    "男主可接著聊、溫和收束或留待之後；各支是正常成年人節奏，不表示邀約、承諾或拒絕她本人。"
  ],
  "emotional_arc": [
    "實際 cafe 相遇先建立各路徑自己的作品脈絡；接觸只承接當場真實交換，未交換或未見者安靜離開此線。",
    "已聯絡時，一則有具體用途的晚間推薦把同次 cafe 交談接起；男主看見內容並回應一項細節。",
    "她逐步傳截圖、分析、meme 與修正；男主觀察此刻文字節奏，沒有替她總結內心。",
    "她確認是否講多了，玩家按自己的節奏回應；三支當地反應與道別後合流，保留下一次正常聯絡。"
  ],
  "required_payoffs": [
    "先按實際取得的累積初遇 eligibility（書店或 cafe 首遇）判定街頭排除 gate，再查當次真實 COM-02J encounter/names/topic/contact；真正 cafe contact 才可共用同晚 online body。cafe-only 仍可按自己的真實 contact 進線上，但不取得書店 reunion eligibility；街頭當次無 contact 則 bypass。",
    "已 contact 路徑保留可相容的《折返月台》公開頁、月台人物／箭頭／反光兩張圖、分析、meme、自我更正、男主具體 uptake、三個 com03j_* reply-choice IDs 與各支自然道別；新推薦須有實際 cafe 討論作橋，未曾答應傳圖就不假稱答應。",
    "保持既有 Discord channel、公开推荐 body、三個 reply choice 及知識邊界；「下午」指同平日 cafe，「晚上」指包裹後當晚；不再交換 contact 或追加熟悉度。",
    "callback 只用可信 replay-local/mainline local history：her_art、shared_work、general_praise 或中性按當次真實話題；shared_work 的具體 COM-01J topic 另需可信 first topic；首次 cafe 路徑不使用書店細節或舊關圖層笑話，除非在 cafe 真的說過。缺失或不可信 history 用不主張特定前事的中性推薦。",
    "Warm／Candid／Playful 在相同真實前事下有相同 knowledge 與 contact 可行性；不能以 tone、topic、數值或正確藝術判斷決定 eligibility。無 contact 的 cafe 路徑普通道別，沒有訊息與 reply-style choice；未見路徑無姓名、topic 或 contact。",
    "線上路徑先有克制首訊、男主就已收到內容提出一項具體看法，再有她較長的分析；meme、截圖與更正服務同一推薦，不揭露匿名創作身份。三個回覆選擇各有當地反應，無 moral penalty 或 romanticSignal。",
    "Memory replay 的 topic/contact/consent 只讀當次可信 snapshot；沒有可證接觸時不補線上內容，不向主線寫入 flag、熟悉度與 reply style。真正完成的初遇 eligibility（書店或 cafe 首遇）可單獨累積持久化，不與主線 snapshot 合併；書店 eligibility 仍獨立決定 cafe reunion。"
  ],
  "exit_state": {
    "relationships": [
      {
        "subject": "jiang_yucheng",
        "toward": "protagonist",
        "label": "acquaintances_with_specific_shared_context",
        "constraints": [
          "已 contact 者有可繼續分享作品的管道和本次訊息節奏；cafe 相遇但未 contact 者只保留普通相識；未見者仍是 strangers。任何路徑都沒有約會、戀愛拒絕或身份承諾。"
        ]
      },
      {
        "subject": "protagonist",
        "toward": "jiang_yucheng",
        "label": "acquaintances_with_specific_shared_context",
        "constraints": [
          "只在實際 contact 且收到推薦時見到她較長的線上討論；無 contact 者不知其帳號或晚間內容，未見者不知姓名。"
        ]
      }
    ],
    "knowledge": [
      {
        "holder": "jiang_yucheng",
        "knows": [
          "保留真實 cafe 前事；已 contact 者才知道男主收到推薦及本次回覆節奏。"
        ],
        "does_not_know": [
          "男主精確職稱、住處、許棠與未披露私人關係。"
        ]
      },
      {
        "holder": "protagonist",
        "knows": [
          "保留真實 cafe 前事；已 contact 者才知道本次實際收到的公開推薦、截圖與她的分析。"
        ],
        "does_not_know": [
          "她的匿名身份、商業委託、住處與未收到的訊息。"
        ]
      }
    ],
    "constraints": [
      "contact_jyc 與 met_jiang_yucheng 保持 COM-02J 事實，未交換/未見均不改為 true；COM-03M 只有已 contact 的 Jiang 路徑才有訊息。",
      "僅線上路徑保存 jyc_com03j_reply_style；本幕無新的 familiarity base increment、romanticSignal、RE、focusHistory 或其他人物 knowledge mutation。",
      "街頭 choice 的 jyc_permanently_excluded 保留當次未相遇事實；未曾在實際遊玩取得任何初遇時仍阻擋後續江線。本次或任何 replay 真正完成 COM-01J 書店初遇或 COM-02J cafe 首遇後，累積初遇 eligibility 可解除後續江線排除；cafe 重逢仍僅由真正完成 COM-01J 的書店 eligibility 決定，cafe-only 重複 replay 保持 initial。不改寫街頭 snapshot，不補姓名、購書、topic、contact 或邀約。拒絕／未交換的安全邊界保持，直到實際取得對應同意或後續選擇；RE／reopening 仍遵守其有界線 gate。",
      "累積進度取已實際取得的最大集合；低進度／街頭／未交換 replay 不清除已解鎖內容，不替換 greatest-progress frontier／主線 Continue。replay 新取得的 eligibility 持久化，但當次 cursor、主線 snapshot 與 refusal facts 各自保存。"
    ]
  },
  "must_not": [
    "不得强制第三次碰面、重複 Discord 交換或已約定傳圖來補 cafe 未發生的 consent；週末留家支没有 COM-01J 記憶。",
    "不得在 cafe 拒絕／未提出聯絡或平日街頭獨走時顯示私訊、姓名、共同 topic、online reply choice，或補造聯絡。",
    "不得以 Warm／Candid／Playful、com02j_* topic、F/T/C/K、正確讀圖或短回覆作 contact／浪漫 eligibility；拒絕不是 RE、負分、romanticSignal 或戀愛 closure。",
    "不得由一條 topic history 推另一條，借 live state 填 Memory replay，或提前揭露匿名帳號、商業委託、住處與跨人物 knowledge。",
    "不得把文字長度當兩種人格或親密承諾，將線上推薦寫成約會／公開群組／私人作品權限，或讓第一人稱斷言她未說出的心理。",
    "本 design pass 不寫最終新對白、不修改其他 scene/runtime/art、不宣稱 Locked Scene、Narrative QA、preview 或 Human acceptance 已完成。",
    "街頭 choice 的 jyc_permanently_excluded 保留當次未相遇事實；未曾在實際遊玩取得任何初遇時仍阻擋後續江線。本次或任何 replay 真正完成 COM-01J 書店初遇或 COM-02J cafe 首遇後，累積初遇 eligibility 可解除後續江線排除；cafe 重逢仍僅由真正完成 COM-01J 的書店 eligibility 決定，cafe-only 重複 replay 保持 initial。不改寫街頭 snapshot，不補姓名、購書、topic、contact 或邀約。拒絕／未交換的安全邊界保持，直到實際取得對應同意或後續選擇；RE／reopening 仍遵守其有界線 gate。"
  ],
  "implementation_mapping": {
    "runtime_only": true,
    "flags": {
      "entry_route": "weekday_reunion_contacted|weekday_first_contacted|no_contact_bypass|permanently_excluded_bypass",
      "met_jiang_yucheng": "read_only_actual_COM01J_or_COM02J_encounter;false_on_weekday_street",
      "player_knows_jyc_name": "read_only_actual_COM02J_name_exchange;false_on_weekday_street",
      "jyc_knows_player_name": "read_only_actual_COM02J_name_exchange;false_on_weekday_street",
      "jyc_creator_work_seen": "read_only_actual_visible_cafe_drawing;false_on_weekday_street",
      "contact_jyc": "read_only_actual_COM02J_mutual_consent_and_exchange;never_set_here",
      "jyc_first_topic": "read_only_trustworthy_COM01J_history_only_on_bookstore_go",
      "jyc_second_topic": "read_only_trustworthy_COM02J_history;unknown_uses_neutral",
      "jyc_com03j_reply_style": "set_only_on_actual_contact_message_path:continue_content|warm_close|save_for_later",
      "relationship.jyc.familiarity": "unchanged_in_COM03J;COM02J_owns_its_actual_encounter_effect",
      "relationship.jyc.romanticSignal": "unchanged",
      "jyc_alias_private": "unchanged",
      "jyc_alias_exposed": "unchanged",
      "recentFocus": "unchanged",
      "focusHistory": "unchanged",
      "requires_jyc_not_excluded": "effective_future_eligibility_guard_respects_any_actual_earned_initial_encounter_COM01J_bookstore_or_COM02J_cafe_first_in_first_play_or_replay;bookstore_only_cafe_reunion_predicate_unchanged;actual_local_consent_and_contact_required_for_messages;no_local_purchase_or_snapshot_merge",
      "jyc_bookstore_ever_earned": "persistent_monotone_eligibility_only_after_actual_COM01J_initial_encounter_in_first_play_or_replay;not_cafe_first_or_generic_met_contact;no_snapshot_merge"
    }
  }
}
